{
  "contract_version": "1.4.0",
  "dataset_id": "synthetic.cross-sectional-bars",
  "dataset_version": "1.0.0",
  "extensions": {},
  "generated_at": "2026-01-01T00:00:00Z",
  "public_or_synthetic": true,
  "streams": [
    {
      "data_sha256": "641ee9d4785784a046b37bf6b0ab84de0b1a743ced84d0e5fa2a45c459ddc569",
      "fields": [
        "close",
        "high",
        "low",
        "open",
        "volume"
      ],
      "kind": "bar",
      "record_count": 18,
      "schema_sha256": "f58dbc46db0cc5c40fc318557cb937277e01a3d9fa0ab04c10b074a18893146c",
      "stream_id": "bars",
      "symbols": [
        "SYNTH.XS-A",
        "SYNTH.XS-B",
        "SYNTH.XS-C"
      ],
      "timeframe": {
        "alignment": "epoch",
        "calendar": "24/7",
        "interval": "P1D",
        "mode": "bar",
        "timezone": "UTC"
      }
    }
  ]
}
