{
  "contract_version": "1.3.0",
  "dataset_id": "synthetic.daily-bars",
  "dataset_version": "1.0.0",
  "extensions": {},
  "generated_at": "2026-01-01T00:00:00Z",
  "public_or_synthetic": true,
  "streams": [
    {
      "data_sha256": "be7aee95ff610f58ed3821fae4a7b5048671cd959b94101db284d98a859f8471",
      "fields": [
        "close",
        "high",
        "low",
        "open",
        "volume"
      ],
      "kind": "bar",
      "record_count": 10,
      "schema_sha256": "f58dbc46db0cc5c40fc318557cb937277e01a3d9fa0ab04c10b074a18893146c",
      "stream_id": "bars",
      "symbols": [
        "SYNTH.DAILY"
      ],
      "timeframe": {
        "alignment": "epoch",
        "calendar": "24/7",
        "interval": "P1D",
        "mode": "bar",
        "timezone": "UTC"
      }
    }
  ]
}
