{
  "contract_version": "1.3.0",
  "dataset_id": "synthetic.twap-bars",
  "dataset_version": "1.0.0",
  "extensions": {},
  "generated_at": "2026-01-01T00:00:00Z",
  "public_or_synthetic": true,
  "streams": [
    {
      "data_sha256": "83b9884f4b54b381744efb554df89690a61f8f7d2b274a0c0f156b140e795489",
      "fields": [
        "close",
        "high",
        "low",
        "open",
        "volume"
      ],
      "kind": "bar",
      "record_count": 6,
      "schema_sha256": "f58dbc46db0cc5c40fc318557cb937277e01a3d9fa0ab04c10b074a18893146c",
      "stream_id": "bars",
      "symbols": [
        "SYNTH.TWAP"
      ],
      "timeframe": {
        "alignment": "epoch",
        "calendar": "24/7",
        "interval": "PT1M",
        "mode": "bar",
        "timezone": "UTC"
      }
    }
  ]
}
